13,classic-diamond-bracelet-d-s017,Classic Diamond Bracelet | D_S017,This contemporary take on a classic diamond bracelet features 1.90ct of round brilliant cut diamonds in hexagonal settings to give a modern look. Diamond Colour G-H Clarity SI. Please call for prices in Platinum.,This contemporary take on a classic diamond bracelet features 1.90ct of round brilliant cut diamonds in hexagonal settings to give a modern look. Diamond Color D-E Clarity VVS. Please call for prices in Platinum.
14,classic-diamond-bracelet-round-cut-ds013,Classic Diamond Bracelet | Round Cut | DS013,"This contemporary take on a classic diamond bracelet features 2.70ct of round brilliant cut diamonds graduating in size towards the centre, truly elegant. We also offer the earring to match. Diamond Colour G-H Clarity SI. Please call for prices in Platinum","This contemporary take on a classic diamond bracelet features 2.70ct of round brilliant cut diamonds graduating in size towards the centre, truly elegant. We also offer the earring to match. Diamond Color D-E Clarity VVS. Please call for prices in Platinum"
15,diamond-bracelet-d-s028,Diamond Bracelet | D_S028,The irresistible show of bracelet looks bigger than a normal bracelet. The diamond is set within gold surrounds to give a bigger look. Diamond Clarity G-H SI. Please call for prices in Platinum.,The irresistible show of bracelet looks bigger than a normal bracelet. The diamond is set within gold surrounds to give a bigger look. Diamond Color D-E Clarity VVS. Please call for prices in Platinum.
16,diamond-bracelet-trilogy-style-d-s006,Diamond Bracelet | Trilogy Style | D_S006,This beautiful bracelet design features diamonds grouped together in a trilogy style. Total diamond weight: 1.90ct. Diamond Colour G-H Clarity SI. Please call for prices in Platinum,This beautiful bracelet design features diamonds grouped together in a trilogy style. Total diamond weight: 1.90ct. Diamond Color D-E Clarity VVS. Please call for prices in Platinum
17,diamond-drop-earrings-round-cut-d-s001,Diamond Drop Earrings | Round Cut | D_S001,"These stunning diamond drop earrings feature 0.66ct of round brilliant cut diamonds grouped in fours, really adding that extra sparkle. Diamond Colour G-H Clarity SI. Please call for prices in Platinum","These stunning diamond drop earrings feature 0.66ct of round brilliant cut diamonds grouped in fours, really adding that extra sparkle. Diamond Color D-E Clarity VVS. Please call for prices in Platinum"
18,diamond-drop-earrings-round-cut-d-s016,Diamond Drop Earrings | Round Cut | D_S016,These beautiful diamond drop earrings feature two rows of round brilliant cut diamonds totaling 0.50ct giving a very classic look. Diamond Color G-H Clarity SI. Please call for prices in Platinum,These beautiful diamond drop earrings feature two rows of round brilliant cut diamonds totaling 0.50ct giving a very classic look. Diamond Color D-E Clarity VVS. Please call for prices in Platinum
19,diamond-earrings-emerald-cut-stud-d-s026,Diamond Earrings | Emerald Cut Stud | D_S026,"Simply stunning, these emerald cut stud earrings offer you timeless elegance, a truly classic pair of earrings. Matches the diamond pendant perfectly. Diamond Colour G-H Clarity SI. Please call for prices in Platinum","Simply stunning, these emerald cut stud earrings offer you timeless elegance, a truly classic pair of earrings. Matches the diamond pendant perfectly. Diamond Color D-E Clarity VVS. Please call for prices in Platinum"
20,diamond-earrings-flower-arrangement-d-s002,Diamond Earrings | Flower Arrangement | D_S002,"These beautiful earrings feature 0.67ct of round brilliant cut diamonds in a flower arrangement, they look stunning with the matching pendant. Diamond Colour G-H Clarity SI. Please call for prices in Platinum","These beautiful earrings feature 0.67ct of round brilliant cut diamonds in a flower arrangement, they look stunning with the matching pendant. Diamond Color D-E Clarity VVS. Please call for prices in Platinum"
21,diamond-earrings-pear-cut-stud-d-s024,Diamond Earrings | Pear Cut Stud | D_S024,"Simply stunning, these pear cut stud earrings offer you timeless elegance, a truly classic pair of earrings. Matches the diamond pendant perfectly. Diamond Colour G-H Clarity SI. Please call for prices in Platinum","Simply stunning, these pear cut stud earrings offer you timeless elegance, a truly classic pair of earrings. Matches the diamond pendant perfectly. Diamond Color D-E Clarity VVS. Please call for prices in Platinum"
22,diamond-earrings-princess-cut-d-s022,Diamond Earrings | Princess Cut | D_S022,"Simply stunning, these princess cut stud earrings offer you timeless elegance, a truly classic pair of earrings. Matches the diamond pendant perfectly. Diamond Colour G-H Clarity SI. Please call for prices in Platinum","Simply stunning, these princess cut stud earrings offer you timeless elegance, a truly classic pair of earrings. Matches the diamond pendant perfectly. Diamond Color D-E Clarity VVS. Please call for prices in Platinum"
23,diamond-earrings-round-cut-stud-d-s021,Diamond Earrings | Round Cut Stud | D_S021,"Simply stunning, these round brilliant cut stud earrings offer you timeless elegance, a truly classic pair of earrings. Matches the diamond pendant perfectly. Diamond Colour G-H Clarity SI. Please call for prices in Platinum","Simply stunning, these round brilliant cut stud earrings offer you timeless elegance, a truly classic pair of earrings. Matches the diamond pendant perfectly. Diamond Color D-E Clarity VVS. Please call for prices in Platinum"
24,diamond-earrings-with-central-peal-d-s012,Diamond Earrings | With Central Peal | D_S012,"These stunning earrings feature a halo of round brilliant cut diamonds totaling 0.85ct and one central pearl in each, they look beautiful matching to the necklace. Diamond Color G-H Clarity SI. Please call for prices in Platinum","These stunning earrings feature a halo of round brilliant cut diamonds totaling 0.85ct and one central pearl in each, they look beautiful matching to the necklace. Diamond Color D-E Clarity VVS. Please call for prices in Platinum"
31,diamond-necklace-brilliant-cut-ds004,Diamond Necklace | Brilliant Cut | DS004,This classic necklace comprises of 3.75ct of round brilliant cut diamonds set between bars in two rows that will compliment the neckline perfectly. Diamond Colour G-H Clarity SI. Please call for prices in Platinum.,This classic necklace comprises of 3.75ct of round brilliant cut diamonds set between bars in two rows that will compliment the neckline perfectly. Diamond Color D-E Clarity VVS. Please call for prices in Platinum.
32,diamond-necklace-classic-droplet-d-s010,Diamond Necklace | Classic Droplet | D_S010,"This stunning necklace features 1.85ct of round brilliant cut diamonds set in pear shaped links, creating a classic droplet look. Diamond Colour G-H Clarity SI. Please call for prices in Platinum","This stunning necklace features 1.85ct of round brilliant cut diamonds set in pear shaped links, creating a classic droplet look. Diamond Color D-E Clarity VVS. Please call for prices in Platinum"
33,diamond-necklace-double-drop-d-s015,Diamond Necklace | Double Drop | D_S015,This stunning diamond set necklace featuring 1.20ct of diamonds compliments your neckline with a double drop. Diamond Colour G-H Clarity SI. Please call for prices in Platinum,This stunning diamond set necklace featuring 1.20ct of diamonds compliments your neckline with a double drop. Diamond Color D-E Clarity VVS. Please call for prices in Platinum
34,diamond-necklace-double-row-d-s009,Diamond Necklace | Double Row | D_S009,This delightful double row of diamonds totaling 2.00ct offers a contemporary yet elegant look. Diamond Colour G-H Clarity SI. Please call for princes in Platinum,This delightful double row of diamonds totaling 2.00ct offers a contemporary yet elegant look. Diamond Color D-E Clarity VVS. Please call for princes in Platinum
35,diamond-necklace-half-diamond-set-ds027,Diamond Necklace | Half Diamond Set | DS027,A half diamond set necklace to give you a fuller look at any party. Graduating brilliant cut diamonds set with gold at the back. Diamond Clarity G-H SI. Please call for prices in Platinum.,A half diamond set necklace to give you a fuller look at any party. Graduating brilliant cut diamonds set with gold at the back. Diamond Color D-E Clarity VVS. Please call for prices in Platinum.
36,diamond-necklace-round-cut-ds008,Diamond Necklace | Round Cut | DS008,This necklace features 1.20ct of round brilliant cut diamonds set between bar links creating a minimal yet elegant look. Diamond Colour G-H Clarity SI. Please call for prices in Platinum,This necklace features 1.20ct of round brilliant cut diamonds set between bar links creating a minimal yet elegant look. Diamond Color D-E Clarity VVS. Please call for prices in Platinum
37,diamond-necklace-tennis-necklace-d-s007,Diamond Necklace | Tennis Necklace | D_S007,This classic tennis necklace features of round brilliant cut diamonds graduating in size towards the centre giving a timeless look. We also stock matching bracelets. Diamond Colour G-H Clarity SI. Please call for prices in Platinum,This classic tennis necklace features of round brilliant cut diamonds graduating in size towards the centre giving a timeless look. We also stock matching bracelets. Diamond Color D-E Clarity VVS. Please call for prices in Platinum
38,diamond-necklace-with-pearl-ds014,Diamond Necklace With Pearl | DS014,This classic take on a traditional droplet necklace features a total of 0.70ct of diamonds and a stunning central set Pearl. Diamond Colour G-H Clarity SI. Please call for prices in Platinum,This classic take on a traditional droplet necklace features a total of 0.70ct of diamonds and a stunning central set Pearl. Diamond Color D-E Clarity VVS. Please call for prices in Platinum
39,diamond-pendant-emerald-cut-d-s025,Diamond Pendant | Emerald Cut | D_S025,This classic single stone pendant gives you a timeless piece of jewellery putting all emphasis on the emerald cut diamond. Diamond Color G-H Clarity SI. Please call for prices in Platinum,This classic single stone pendant gives you a timeless piece of jewellery putting all emphasis on the emerald cut diamond. Diamond Color D-E Clarity VVS. Please call for prices in Platinum
40,diamond-pendant-pear-cut-d-s023,Diamond Pendant | Pear Cut | D_S023,This classic single stone pendant gives you a timeless piece of jewellery&nbsp;putting all emphasis on the pear cut diamond. Diamond Color G-H Clarity SI. Please call for prices in Platinum,This classic single stone pendant gives you a timeless piece of jewellery&nbsp;putting all emphasis on the pear cut diamond. Diamond Color D-E Clarity VVS. Please call for prices in Platinum
41,diamond-pendant-princess-cut-d-s020,Diamond Pendant | Princess Cut | D_S020,This classic single stone pendant gives you a timeless piece of jewellery&nbsp;putting all emphasis on the princess cut diamond. Diamond Color G-H Clarity SI. Please call for prices in Platinum,This classic single stone pendant gives you a timeless piece of jewellery&nbsp;putting all emphasis on the princess cut diamond. Diamond Color D-E Clarity VVS. Please call for prices in Platinum
42,diamond-pendant-round-brilliant-cut-ds003,Diamond Pendant | Round Brilliant Cut | DS003,"This modern pendant features 0.34ct of round brilliant cut diamonds in a flower arrangement, they look stunning with the matching earrings. Diamond Colour G-H Clarity SI. Please call for prices in Platinum","This modern pendant features 0.34ct of round brilliant cut diamonds in a flower arrangement, they look stunning with the matching earrings. Diamond Color D-E Clarity VVS. Please call for prices in Platinum"
43,diamond-pendant-round-cut-d-s019,Diamond Pendant | Round Cut | D_S019,This classic single stone pendant gives you a timeless piece of jewellery&nbsp;putting all emphasis on the round brilliant cut diamond. Diamond Color G-H Clarity SI. Please call for prices in Platinum,This classic single stone pendant gives you a timeless piece of jewellery&nbsp;putting all emphasis on the round brilliant cut diamond. Diamond Color D-E Clarity VVS. Please call for prices in Platinum
44,diamond-pendant-trilogy-droplet-ds018,Diamond Pendant | Trilogy Droplet | DS018,This classic trilogy droplet pendant featuring a total diamond weight of 0.30ct gives you a timeless contemporary look. Diamond Colour G-H Clarity SI. Please call for prices in Platinum,This classic trilogy droplet pendant featuring a total diamond weight of 0.30ct gives you a timeless contemporary look. Diamond Color D-E Clarity VVS. Please call for prices in Platinum
45,diamond-tennis-bracelet-d-s005,Diamond Tennis Bracelet | D_S005,This classic tennis bracelet consists of round brilliant cut diamonds creating a timeless and elegant look. We also stock the matching necklace. Diamond Colour G-H Clarity SI. Please call for prices in Platinum,This classic tennis bracelet consists of round brilliant cut diamonds creating a timeless and elegant look. We also stock the matching necklace. Diamond Color D-E Clarity VVS. Please call for prices in Platinum
46,intermittent-diamond-necklace-d-s011,Intermittent Diamond Necklace | D_S011,This Intermittent diamond set necklace creates an elegant look for any party girl. Diamond Quality G-H Clarity SI.,This Intermittent diamond set necklace creates an elegant look for any party girl. Diamond Color D-E Clarity VVS.
47,mens-diamond-wedding-band-wed025,Mens Diamond Wedding Band | WED025,This modern look wedding band is available in 0.95ct and features three rows of round brilliant cut diamonds grain set to give a very sparkly look! Diamond Colour F-G Clarity VS-SI.,This modern look wedding band is available in 0.95ct and features three rows of round brilliant cut diamonds grain set to give a very sparkly look! Diamond Color D-E Clarity VVS.
48,mens-diamond-wedding-ring-wed024,Mens Diamond Wedding Ring | WED024,This modern look wedding band is available in 1ct and features three rows of round brilliant cut diamonds grain set to give a very sparkly look! Diamond Colour F-G Clarity VS-SI.,This modern look wedding band is available in 1ct and features three rows of round brilliant cut diamonds grain set to give a very sparkly look! Diamond Color D-E Clarity VVS.
49,plain-wedding-ring-court-shaped-wed001,Plain Wedding Ring | Court Shaped | WED001,"The most popular of all wedding band styles, these court shape rings offer a timeless design and give comfort and adjustability. Diamond Colour G-H Clarity SI.","The most popular of all wedding band styles, these court shape rings offer a timeless design and give comfort and adjustability.Diamond Color D-E Clarity VVS"
50,plain-wedding-ring-wed003,Plain Wedding Ring | WED003,"The most popular of all wedding band styles, these court shape rings offer a timeless design and give comfort and adjustability. Diamond Colour G-H Clarity SI.","The most popular of all wedding band styles, these court shape rings offer a timeless design and give comfort and adjustability.Diamond Color D-E Clarity VVS"
51,d-shaped-wedding-band,D Shaped Wedding Band,"The most popular of all wedding band styles, these court shape rings offer a timeless design and give comfort and adjustability. Diamond Colour G-H Clarity SI.","The most popular of all wedding band styles, these court shape rings offer a timeless design and give comfort and adjustability.Diamond Color D-E Clarity VVS"
53,court-shaped-wedding-band,Court Shape Wedding Band,"The most popular of all wedding band styles, these court shape rings offer a timeless design and give comfort and adjustability. Diamond Colour G-H Clarity SI.","The most popular of all wedding band styles, these court shape rings offer a timeless design and give comfort and adjustability.Diamond Color D-E Clarity VVS"
54,rounded-inner-flatter-wedding-band,Rounded Inner Flatter Wedding Band,"Stylish yet traditional, these wedding bands come with a rounded inner to give maximum comfort. A flatter style than the more traditional court wedding ring giving a slightly more contemporary look. Diamond Colour G-H Clarity SI.","Stylish yet traditional, these wedding bands come with a rounded inner to give maximum comfort. A flatter style than the more traditional court wedding ring giving a slightly more contemporary look.Diamond Color D-E Clarity VVS"
55,rounded-inner-flatter-style-wedding-band,Rounded Inner Flatter Style Wedding Band,"Stylish yet traditional, these wedding bands come with a rounded inner to give maximum comfort. A flatter style compared to the more traditional court wedding ring, providing a slightly more contemporary look. Diamond Colour G-H Clarity SI.","Stylish yet traditional, these wedding bands come with a rounded inner to give maximum comfort. A flatter style compared to the more traditional court wedding ring, providing a slightly more contemporary look. Diamond Color D-E Clarity VVS"
56,chunky-wedding-bands,Chunky Wedding Bands,"For an up to the minute look, these chunky wedding bands have a bevelled&nbsp;edge to give sharp lines and add two different reflections of light. Diamond Colour G-H Clarity SI.","For an up to the minute look, these chunky wedding bands have a bevelled&nbsp;edge to give sharp lines and add two different reflections of light.Diamond Color D-E Clarity VVS"
59,court-shape-wedding-ring,Court Shape Wedding Ring,A court shape ring with a difference. This comfortable traditional court ring has a fine beaded edge to give more of a textured look. Diamond Colour G-H Clarity SI.,A court shape ring with a difference. This comfortable traditional court ring has a fine beaded edge to give more of a textured look.Diamond Color D-E Clarity VVS
61,court-shaped-wedding-ring,Court Shaped Wedding Ring,A court shape ring with a difference. This comfortable traditional court ring has a fine beaded edge to give more of a textured look. Diamond Colour G-H Clarity SI.,A court shape ring with a difference. This comfortable traditional court ring has a fine beaded edge to give more of a textured look.Diamond Color D-E Clarity VVS
63,d-shape-wedding-band,D Shape Wedding Band,"This D shaped wedding band offers something a bit different, with a matt finish and a central diamond cut polished line it gives a modern look. Diamond Colour G-H Clarity SI.","This D shaped wedding band offers something a bit different, with a matt finish and a central diamond cut polished line it gives a modern look.Diamond Color D-E Clarity VVS"
64,modern-6mm-wedding-band,Modern 6mm Wedding Band,"This modern 6mm wedding band features side set diamonds on both the top and bottom of the band to give an understated glimmer, diamond weight totals 0.38ct. Diamond Colour F-G Clarity VS-SI.","This modern 6mm wedding band features side set diamonds on both the top and bottom of the band to give an understated glimmer, diamond weight totals 0.38ct. Diamond Color D-E Clarity VVS."
65,cut-out-diamond-wedding-band,Cut Out Diamond Wedding Band,"Something a bit different, this matt finished band features a cut out diamond set cross pattern all the way around the band, total diamond weight is 0.42ct. Diamond Colour F-G Clarity VS-SI.","Something a bit different, this matt finished band features a cut out diamond set cross pattern all the way around the band, total diamond weight is 0.42ct. Diamond Color D-E Clarity VVS."
66,6mm-court-shaped-round-wedding-band,6mm Court Shaped Round Wedding Band,This 6mm court shaped band is set with three round brilliant cut diamonds to add a little sparkle to your wedding band. Diamond Colour F-G Clarity VS-SI.,This 6mm court shaped band is set with three round brilliant cut diamonds to add a little sparkle to your wedding band. Diamond Color D-E Clarity VVS.
67,5mm-flat-round-cut-diamond-wedding-band,5mm Flat Round Cut Diamond Wedding Band,This 5mm flat wedding band is set with 12 round brilliant cut diamonds totaling 0.18ct set diagonally in intervals around the band to give a little added sparkle to your regular flat band. Diamond Color F-G Clarity VS-SI.,This 5mm flat wedding band is set with 12 round brilliant cut diamonds totaling 0.18ct set diagonally in intervals around the band to give a little added sparkle to your regular flat band. Diamond Color D-E Clarity VVS.
68,7mm-princesscut-diamonds-wedding-band,7mm Princess Cut Diamonds Wedding Band,This 7mm wedding band is offset with 0.58ct of princess cut diamonds set 50% of the way around the band giving a wide contemporary look. Diamond Colour F-G Clarity VS-SI.,This 7mm wedding band is offset with 0.58ct of princess cut diamonds set 50% of the way around the band giving a wide contemporary look. Diamond Color D-E Clarity VVS.
69,6mm-court-shaped-wedding-band,6mm Court Shaped Wedding Band,This 6mm court shaped wedding band is matt finished with diamond cut edging and square set with three round brilliant cut diamonds to add a little sparkle to your regular court shaped band. Diamond Colour F-G Clarity VS-SI.,This 6mm court shaped wedding band is matt finished with diamond cut edging and square set with three round brilliant cut diamonds to add a little sparkle to your regular court shaped band. Diamond Color D-E Clarity VVS.
70,women-s-diamond-eternity-ring-et105,Women's Diamond Eternity Ring | ET105,"This is our classic eternity ring, channel set with round brilliant cut diamonds spreading 60% of the way around the band to give a full-set look. Sits perfectly alongside most other rings and can be used as a wedding or eternity band. Diamond colour F, Clarity VS.","This is our classic eternity ring, channel set with round brilliant cut diamonds spreading 60% of the way around the band to give a full-set look. Sits perfectly alongside most other rings and can be used as a wedding or eternity band. Diamond Color D-E Clarity VVS."
71,women-s-diamond-eternity-ring-et106,Women's Diamond Eternity Ring | ET106,"This is our classic eternity ring, channel set with round brilliant cut diamonds spreading 60% of the way around the band to give a full-set look. Sits perfectly alongside most other rings and can be used as a wedding or eternity band. Diamond colour F, Clarity VS.","This is our classic eternity ring, channel set with round brilliant cut diamonds spreading 60% of the way around the band to give a full-set look. Sits perfectly alongside most other rings and can be used as a wedding or eternity band. Diamond Color D-E Clarity VVS."
72,women-s-diamond-eternity-ring-et108,Women's Diamond Eternity Ring | ET108,"This is our classic eternity ring, channel set with princess cut diamonds spreading 40% of the way around the band. Sits perfectly alongside most other rings and can be used as a wedding or eternity band. Diamond colour F, Clarity VS.","This is our classic eternity ring, channel set with princess cut diamonds spreading 40% of the way around the band. Sits perfectly alongside most other rings and can be used as a wedding or eternity band. Diamond Color D-E Clarity VVS."
73,women-s-diamond-eternity-ring-et109,Women's Diamond Eternity Ring | ET109,"This is our classic eternity ring, channel set with princess cut diamonds spreading 40% of the way around the band. Sits perfectly alongside most other rings and can be used as a wedding or eternity band. Diamond colour F, Clarity VS.","This is our classic eternity ring, channel set with princess cut diamonds spreading 40% of the way around the band. Sits perfectly alongside most other rings and can be used as a wedding or eternity band. Diamond Color D-E Clarity VVS."
74,women-s-diamond-eternity-ring-et110,Women's Diamond Eternity Ring | ET110,"This is our classic eternity ring, channel set with of princess cut diamonds spreading 60% of the way around the band to give a full-set look. Sits perfectly alongside most other rings and can be used as a wedding or eternity band. Diamond colour F, Clarity VS.","This is our classic eternity ring, channel set with of princess cut diamonds spreading 60% of the way around the band to give a full-set look. Sits perfectly alongside most other rings and can be used as a wedding or eternity band. Diamond Color D-E Clarity VVS."
75,women-s-diamond-eternity-ring-et111,Women's Diamond Eternity Ring | ET111,"This is our classic eternity ring, channel set with of princess cut diamonds spreading 60% of the way around the band to give a full-set look. Sits perfectly alongside most other rings and can be used as a wedding or eternity band. Diamond colour F, Clarity VS.","This is our classic eternity ring, channel set with of princess cut diamonds spreading 60% of the way around the band to give a full-set look. Sits perfectly alongside most other rings and can be used as a wedding or eternity band. Diamond Color D-E Clarity VVS."
76,women-s-diamond-eternity-ring-et112,Women's Diamond Eternity Ring | ET112,This contemporary eternity ring has round brilliant cut diamonds bar-set 50% of the way around the band. Diamond colour F-G diamond clarity VS-SI.,This contemporary eternity ring has round brilliant cut diamonds bar-set 50% of the way around the band. Diamond Color D-E Clarity VVS.
77,women-s-diamond-wedding-ring-wed013,Women's Diamond Wedding Ring | WED013,This vintage inspired design features either 0.15ct or 0.25ct of round brilliant cut diamonds set 50% of the way around the band but with a mill grain edge. This popular band sits perfectly with many of our engagement rings. Diamond Color F-G Clarity VS-SI.,This vintage inspired design features either 0.15ct or 0.25ct of round brilliant cut diamonds set 50% of the way around the band but with a mill grain edge. This popular band sits perfectly with many of our engagement rings. Diamond Color D-E Clarity VVS.
